Protein id	Contig id	Start	Stop	Strand	Element symbol	Element name	Scope	Type	Subtype	Class	Subclass	Method	Target length	Reference sequence length	% Coverage of reference	% Identity to reference	Alignment length	Closest reference accession	Closest reference name	HMM accession	HMM description
NA	562.100171.con.0002	32746	33177	+	marR_S3N	Escherichia ampicillin/chloramphenicol/quinolone/rifampin/tetracycline resistant MarR	core	AMR	POINT	MULTIDRUG	AMPICILLIN/CHLORAMPHENICOL/QUINOLONE/RIFAMPIN/TETRACYCLINE	POINTX	144	144	100.00	97.92	144	WP_000843414.1	transcriptional regulator MarR	NA	NA
NA	562.100171.con.0002	392989	393318	-	emrE	multidrug efflux SMR transporter EmrE	plus	STRESS	BIOCIDE	EFFLUX	EFFLUX	BLASTX	110	110	100.00	98.18	110	CAA77936.1	multidrug efflux SMR transporter EmrE	NA	NA
NA	562.100171.con.0002	427117	427671	-	bfpA	type IV pilus major subunit protein BfpA	plus	VIRULENCE	VIRULENCE	NA	NA	BLASTX	185	185	100.00	97.30	185	VUC71241.1	type IV pilus major subunit protein BfpA	NA	NA
NA	562.100171.con.0002	450255	452054	-	ybtQ	yersiniabactin ABC transporter ATP-binding/permease protein YbtQ	plus	VIRULENCE	VIRULENCE	NA	NA	BLASTX	600	600	100.00	99.67	600	AAC69584.1	yersiniabactin ABC transporter ATP-binding/permease protein YbtQ	NA	NA
NA	562.100171.con.0002	452044	453843	-	ybtP	yersiniabactin ABC transporter ATP-binding/permease protein YbtP	plus	VIRULENCE	VIRULENCE	NA	NA	BLASTX	600	600	100.00	99.50	600	CAA21388.1	yersiniabactin ABC transporter ATP-binding/permease protein YbtP	NA	NA
NA	562.100171.con.0002	497148	501512	-	clbN	colibactin non-ribosomal peptide synthetase ClbN	plus	VIRULENCE	VIRULENCE	NA	NA	EXACTX	1455	1455	100.00	100.00	1455	AMH08480.1	colibactin non-ribosomal peptide synthetase ClbN	NA	NA
NA	562.100171.con.0002	525958	535575	-	clbB	colibactin hybrid non-ribosomal peptide synthetase/type I polyketide synthase ClbB	plus	VIRULENCE	VIRULENCE	NA	NA	EXACTX	3206	3206	100.00	100.00	3206	AMQ58400.1	colibactin hybrid non-ribosomal peptide synthetase/type I polyketide synthase ClbB	NA	NA
NA	562.100171.con.0003	4531	5643	+	iroB	salmochelin biosynthesis C-glycosyltransferase IroB	plus	VIRULENCE	VIRULENCE	NA	NA	BLASTX	371	371	100.00	99.46	371	EOW04219.1	salmochelin biosynthesis C-glycosyltransferase IroB	NA	NA
NA	562.100171.con.0003	5786	9442	+	iroC	salmochelin/enterobactin export ABC transporter IroC	plus	VIRULENCE	VIRULENCE	NA	NA	BLASTX	1219	1219	100.00	99.43	1219	AUH19662.1	salmochelin/enterobactin export ABC transporter IroC	NA	NA
NA	562.100171.con.0003	9549	10775	+	iroD	catecholate siderophore esterase IroD	plus	VIRULENCE	VIRULENCE	NA	NA	BLASTX	409	409	100.00	99.51	409	ACJ63529.1	catecholate siderophore esterase IroD	NA	NA
NA	562.100171.con.0003	10863	11816	+	iroE	catecholate siderophore esterase IroE	plus	VIRULENCE	VIRULENCE	NA	NA	BLASTX	318	318	100.00	98.43	318	ACJ63530.1	catecholate siderophore esterase IroE	NA	NA
NA	562.100171.con.0003	11867	14041	-	iroN	siderophore salmochelin receptor IroN	plus	VIRULENCE	VIRULENCE	NA	NA	BLASTX	725	725	100.00	99.72	725	ABB61187.1	siderophore salmochelin receptor IroN	NA	NA
NA	562.100171.con.0003	17241	17729	-	sfaS	S-fimbrial adhesin minor subunit SfaS	plus	VIRULENCE	VIRULENCE	NA	NA	EXACTX	163	163	100.00	100.00	163	ABE06598.1	S-fimbrial adhesin minor subunit SfaS	NA	NA
NA	562.100171.con.0003	18294	20921	-	sfaF	S/F1C fimbrial biogenesis usher protein SfaF/FocD	plus	VIRULENCE	VIRULENCE	NA	NA	EXACTX	876	876	100.00	100.00	876	ASJ31253.1	S/F1C fimbrial biogenesis usher protein SfaF/FocD	NA	NA
NA	562.100171.con.0005	5361	8462	-	acrF	multidrug efflux RND transporter permease subunit AcrF	plus	AMR	AMR	EFFLUX	EFFLUX	BLASTX	1034	1034	100.00	99.61	1034	AAC76298.1	multidrug efflux RND transporter permease subunit AcrF	NA	NA
NA	562.100171.con.0005	320301	324860	+	sslE	lipoprotein metalloprotease SslE	plus	VIRULENCE	VIRULENCE	NA	NA	BLASTX	1520	1520	100.00	90.67	1522	ADE89421.1	lipoprotein metalloprotease SslE	NA	NA
NA	562.100171.con.0006	81730	82917	-	emrD	multidrug efflux MFS transporter EmrD	plus	AMR	AMR	EFFLUX	EFFLUX	BLASTX	396	396	100.00	99.49	396	EFF04178.1	multidrug efflux MFS transporter EmrD	NA	NA
NA	562.100171.con.0009	203006	203269	-	ariR	biofilm/acid-resistance regulator AriR	plus	STRESS	ACID	NA	NA	BLASTX	88	88	100.00	97.73	88	AAC74250.1	biofilm/acid-resistance regulator AriR	NA	NA
NA	562.100171.con.0012	140871	142001	+	blaEC	BlaEC family class C beta-lactamase	plus	AMR	AMR	BETA-LACTAM	BETA-LACTAM	BLASTX	377	377	100.00	98.41	377	AAZ85965.1	cephalosporin-hydrolyzing class C beta-lactamase EC-5	NA	NA
NA	562.100171.con.0013	51892	56139	-	fdeC	inverse autotransporter adhesin FdeC	plus	VIRULENCE	VIRULENCE	NA	NA	BLASTX	1416	1416	100.00	99.93	1416	ABE05822.1	inverse autotransporter adhesin FdeC	NA	NA
NA	562.100171.con.0013	75845	79972	+	vactox	vacuolating autotransporter toxin Vat	plus	VIRULENCE	VIRULENCE	NA	NA	EXACTX	1376	1376	100.00	100.00	1376	AAN78874.1	vacuolating autotransporter toxin Vat	NA	NA
NA	562.100171.con.0015	117411	117701	-	iss	increased serum survival lipoprotein Iss	plus	VIRULENCE	VIRULENCE	NA	NA	EXACTX	97	97	100.00	100.00	97	ADN71659.1	increased serum survival lipoprotein Iss	NA	NA
NA	562.100171.con.0016	103929	106028	-	mchF	microcin H47 export transporter peptidase/ATP-binding subunit MchF	plus	VIRULENCE	VIRULENCE	NA	NA	BLASTX	700	700	100.00	99.71	700	AFS85685.1	microcin H47 export transporter peptidase/ATP-binding subunit MchF	NA	NA
NA	562.100171.con.0016	109751	109975	-	mchB	microcin H47	plus	VIRULENCE	VIRULENCE	NA	NA	EXACTX	75	75	100.00	100.00	75	CAB54534.2	microcin H47	NA	NA
NA	562.100171.con.0018	53109	54476	-	ibeA	putative intracellular survival FAD-dependent oxidoreductase IbeA	plus	VIRULENCE	VIRULENCE	NA	NA	BLASTX	456	456	100.00	98.25	456	AAF98391.2	putative intracellular survival FAD-dependent oxidoreductase IbeA	NA	NA
